{
  "$schema": "https://raw.githubusercontent.com/nodelook/data/refs/heads/main/.schema.json",
  "name": {
    "en": "Family",
    "fa": "خانواده"
  },
  "description": {
    "en": "Adult Content Filtering\nTests whether your DNS or network blocks adult-content websites.\n\n# Cloudflare Family\nIPv4: 1.1.1.3\nIPv4: 1.0.0.3\nIPv6: 2606:4700:4700::1113\nIPv6: 2606:4700:4700::1003\n\n# CleanBrowsing – Family Filter\nIPv4: 185.228.168.168\nIPv4: 185.228.169.168\nIPv6: 2a0d:2a00:1::\nIPv6: 2a0d:2a00:2::\n\n# AdGuard Family Protection\nIPv4: 94.140.14.15\nIPv4: 94.140.15.16\nIPv6: 2a10:50c0::bad1:ff\nIPv6: 2a10:50c0::bad2:ff\n\nSUCCESS: age verification is disabled",
    "fa": "فیلتر محتوای بزرگسال\nبررسی می‌کند که آیا دی‌ان‌اس یا شبکه‌ی شما وب‌سایت‌های دارای محتوای بزرگسال را مسدود می‌کند یا خیر.\n\n# Cloudflare Family\nIPv4: 1.1.1.3\nIPv4: 1.0.0.3\nIPv6: 2606:4700:4700::1113\nIPv6: 2606:4700:4700::1003\n\n# CleanBrowsing – Family Filter\nIPv4: 185.228.168.168\nIPv4: 185.228.169.168\nIPv6: 2a0d:2a00:1::\nIPv6: 2a0d:2a00:2::\n\n# AdGuard Family Protection\nIPv4: 94.140.14.15\nIPv4: 94.140.15.16\nIPv6: 2a10:50c0::bad1:ff\nIPv6: 2a10:50c0::bad2:ff\n\nموفقیت: احراز سن غیرفعال است"
  },
  "color": "#FF4285F4",
  "items": [
    {
      "name": {
        "en": "PornHub",
        "fa": "ردیت"
      },
      "url": "https://www.pornhub.com/api/v1/video/ajax_related_video",
      "shouldContain": "Success!",
      "address": "https://www.pornhub.com/"
    }
  ]
}