{
  "$schema": "https://raw.githubusercontent.com/nodelook/data/refs/heads/main/.schema.json",
  "name": {
    "en": "Debian",
    "fa": "دبیان"
  },
  "description": {
    "en": "Debian Linux Mirrors\nsudo nano /etc/apt/sources.list",
    "fa": "آینه‌های لینوکس دبیان\nsudo nano /etc/apt/sources.list"
  },
  "color": "#FF34A853",
  "items": [
    {
      "name": {
        "en": "Debian",
        "fa": "دبیان"
      },
      "url": "https://deb.debian.org/debian/dists/stable/Release",
      "shouldContain": "Debian",
      "address": "https://"
    },
    {
      "name": {
        "en": "[China] University of Science and Technology of China (HTTP)",
        "fa": "[چین] دانشگاه علم و فناوری چین (اچ‌تی‌تی‌پی)"
      },
      "url": "http://mirrors.ustc.edu.cn/debian/dists/stable/Release",
      "shouldContain": "Debian",
      "address": "http://"
    },
    {
      "name": {
        "en": "[China] University of Science and Technology of China (HTTPS)",
        "fa": "[چین] دانشگاه علم و فناوری چین (اچ‌تی‌تی‌پی‌اس)"
      },
      "url": "https://mirrors.ustc.edu.cn/debian/dists/stable/Release",
      "shouldContain": "Debian",
      "address": "https://"
    },
    {
      "name": {
        "en": "[China] Tsinghua University (HTTP)",
        "fa": "[چین] دانشگاه تسینگ‌هوا (اچ‌تی‌تی‌پی)"
      },
      "url": "http://mirrors.tuna.tsinghua.edu.cn/debian/dists/stable/Release",
      "shouldContain": "Debian",
      "address": "http://"
    },
    {
      "name": {
        "en": "[China] Tsinghua University (HTTPS)",
        "fa": "[چین] دانشگاه تسینگ‌هوا (اچ‌تی‌تی‌پی‌اس)"
      },
      "url": "https://mirrors.tuna.tsinghua.edu.cn/debian/dists/stable/Release",
      "shouldContain": "Debian",
      "address": "https://"
    }
  ]
}