{
  "$schema": "https://raw.githubusercontent.com/nodelook/data/refs/heads/main/.schema.json",
  "name": {
    "en": "Helm",
    "fa": "هلم"
  },
  "description": {
    "en": "Helm Chart Repositories\nhelm repo add <name> <repository-url>",
    "fa": "مخازن نمودار هلم\nhelm repo add <name> <repository-url>"
  },
  "color": "#FF4285F4",
  "items": [
    {
      "name": {
        "en": "Broadcom",
        "fa": "برودکام"
      },
      "url": "https://repo.broadcom.com/bitnami-files/index.yaml",
      "shouldContain": "apiVersion",
      "address": "https://repo.broadcom.com/bitnami-files"
    },
    {
      "name": {
        "en": "JetStack",
        "fa": "جت‌استک"
      },
      "url": "https://charts.jetstack.io/index.yaml",
      "shouldContain": "apiVersion",
      "address": "https://charts.jetstack.io"
    },
    {
      "name": {
        "en": "Prometheus",
        "fa": "پرومتئوس"
      },
      "url": "https://prometheus-community.github.io/helm-charts/index.yaml",
      "shouldContain": "apiVersion",
      "address": "https://prometheus-community.github.io/helm-charts"
    },
    {
      "name": {
        "en": "Grafana",
        "fa": "گرافانا"
      },
      "url": "https://grafana.github.io/helm-charts/index.yaml",
      "shouldContain": "apiVersion",
      "address": "https://grafana.github.io/helm-charts"
    },
    {
      "name": {
        "en": "Kubernetes",
        "fa": "کوبِرنِتیز"
      },
      "url": "https://kubernetes.github.io/ingress-nginx/index.yaml",
      "shouldContain": "apiVersion",
      "address": "https://kubernetes.github.io/ingress-nginx"
    },
    {
      "name": {
        "en": "Argo Project",
        "fa": "پروژه‌ی آرگو"
      },
      "url": "https://argoproj.github.io/argo-helm/index.yaml",
      "shouldContain": "apiVersion",
      "address": "https://argoproj.github.io/argo-helm"
    },
    {
      "name": {
        "en": "Elastic",
        "fa": "الاستیک"
      },
      "url": "https://helm.elastic.co/index.yaml",
      "shouldContain": "apiVersion",
      "address": "https://helm.elastic.co"
    },
    {
      "name": {
        "en": "HashiCorp",
        "fa": "هاشی‌کُرپ"
      },
      "url": "https://helm.releases.hashicorp.com/index.yaml",
      "shouldContain": "apiVersion",
      "address": "https://helm.releases.hashicorp.com"
    },
    {
      "name": {
        "en": "OpenTelemetry",
        "fa": "اوپن‌تلمتری"
      },
      "url": "https://open-telemetry.github.io/opentelemetry-helm-charts/index.yaml",
      "shouldContain": "apiVersion",
      "address": "https://open-telemetry.github.io/opentelemetry-helm-charts"
    }
  ]
}