{
  "$schema": "https://raw.githubusercontent.com/nodelook/data/refs/heads/main/.schema.json",
  "name": {
    "en": "Tor",
    "fa": "تور"
  },
  "description": {
    "en": "Tor Network Services",
    "fa": "سرویس‌های شبکه‌ی تور"
  },
  "color": "#FF4285F4",
  "items": [
    {
      "name": {
        "en": "Internet Archive",
        "fa": "بایگانی اینترنت"
      },
      "url": "http://archivep75mbjunhxc6x4j5mwjmomyxb573v42baldlqu56ruil2oiad.onion/download/xmha97/status",
      "shouldContain": "200",
      "address": "http://archivep75mbjunhxc6x4j5mwjmomyxb573v42baldlqu56ruil2oiad.onion/"
    },
    {
      "name": {
        "en": "Reddit",
        "fa": "ریدیت"
      },
      "url": "http://www.reddittorjg6rue252oqsxryoxengawnmo46qy4kyii5wtqnwfj4ooad.onion/robots.txt",
      "shouldContain": "Disallow",
      "address": "http://www.reddittorjg6rue252oqsxryoxengawnmo46qy4kyii5wtqnwfj4ooad.onion/"
    }
  ]
}