{
  "$schema": "https://raw.githubusercontent.com/nodelook/data/refs/heads/main/.schema.json",
  "name": {
    "en": "NSFW",
    "fa": "ن‌س‌ف‌و"
  },
  "description": {
    "en": "Not Safe For Work",
    "fa": "نامناسب برای محیط کار"
  },
  "color": "#FF4285F4",
  "items": [
    {
      "name": {
        "en": "Site 1",
        "fa": "سایت ۱"
      },
      "url": "https://www.pornhub.com/passkey/preflight",
      "shouldContain": "false",
      "address": "https://***"
    },
    {
      "name": {
        "en": "Site 2",
        "fa": "سایت ۲"
      },
      "url": "https://www.fuq.com/robots.txt",
      "shouldContain": "Disallow",
      "address": "https://***"
    },
    {
      "name": {
        "en": "Site 3",
        "fa": "سایت ۳"
      },
      "url": "https://xhamster.com/robots.txt",
      "shouldContain": "Disallow",
      "address": "https://***"
    },
    {
      "name": {
        "en": "Site 4",
        "fa": "سایت ۴"
      },
      "url": "https://www.xnxx.com/robots.txt",
      "shouldContain": "Disallow",
      "address": "https://***"
    },
    {
      "name": {
        "en": "Site 5",
        "fa": "سایت ۵"
      },
      "url": "https://www.redgifs.com/robots.txt",
      "shouldContain": "Disallow",
      "address": "https://***"
    },
    {
      "name": {
        "en": "Site 6",
        "fa": "سایت ۶"
      },
      "url": "https://stripchat.com/robots.txt",
      "shouldContain": "Disallow",
      "address": "https://***"
    }
  ]
}