{
  "$schema": "https://raw.githubusercontent.com/nodelook/data/refs/heads/main/.schema.json",
  "name": {
    "en": "Internet",
    "fa": "اینترنت"
  },
  "description": {
    "en": "Internet",
    "fa": "اینترنت"
  },
  "color": "#FF4285F4",
  "items": [
    {
      "name": {
        "en": "Irancell",
        "fa": "ایرانسل"
      },
      "url": "https://insufficient.irancell.ir/",
      "shouldContain": "به پایان رسیده است",
      "address": "https://irancell.ir/"
    },
    {
      "name": {
        "en": "IR-MCI",
        "fa": "همراه‌اول"
      },
      "url": "https://mci.ir/robots.txt",
      "shouldContain": "Disallow",
      "address": "https://mci.ir/"
    }
  ]
}