{
  "$schema": "https://raw.githubusercontent.com/nodelook/data/refs/heads/main/.schema.json",
  "name": {
    "en": "Julia",
    "fa": "جولیا"
  },
  "description": {
    "en": "Julia Mirrors",
    "fa": "آینه‌های جولیا"
  },
  "color": "#FF34A853",
  "items": [
    {
      "name": {
        "en": "Julia",
        "fa": "جولیا"
      },
      "url": "https://eu-central.pkg.julialang.org/registries.conservative",
      "shouldContain": "/registry/",
      "address": "https://"
    },
    {
      "name": {
        "en": "[China] Tsinghua University",
        "fa": "[چین] دانشگاه تسینگ‌هوا"
      },
      "url": "https://mirrors.tuna.tsinghua.edu.cn/julia/registries.conservative",
      "shouldContain": "/registry/",
      "address": "https://"
    },
    {
      "name": {
        "en": "[China] University of Science and Technology of China",
        "fa": "[چین] دانشگاه علم و فناوری چین"
      },
      "url": "https://mirrors.ustc.edu.cn/julia/registries.conservative",
      "shouldContain": "/registry/",
      "address": "https://"
    },
    {
      "name": {
        "en": "[China] Beijing Foreign Studies University",
        "fa": "[چین] دانشگاه مطالعات خارجی پکن"
      },
      "url": "https://mirrors.bfsu.edu.cn/julia/registries.conservative",
      "shouldContain": "/registry/",
      "address": "https://"
    },
    {
      "name": {
        "en": "[China] Shanghai Jiao Tong University",
        "fa": "[چین] دانشگاه شانگهای جیائو تونگ"
      },
      "url": "https://mirrors.sjtug.sjtu.edu.cn/julia/registries.conservative",
      "shouldContain": "/registry/",
      "address": "https://"
    },
    {
      "name": {
        "en": "[China] Nanjing University (HTTP)",
        "fa": "[چین] دانشگاه نانجینگ (اچ‌تی‌تی‌پی)"
      },
      "url": "https://mirror.nju.edu.cn/julia/registries.conservative",
      "shouldContain": "/registry/",
      "address": "https://"
    },
    {
      "name": {
        "en": "[China] Southern University of Science and Technology",
        "fa": "[چین] دانشگاه علم و فناوری جنوب"
      },
      "url": "https://mirrors.sustech.edu.cn/julia/registries.conservative",
      "shouldContain": "/registry/",
      "address": "https://"
    }
  ]
}